{"auditNotes":"M32 POST-TRAIN-EVAL-PACK-001: Evaluated 10000 positions from frozen eval v2. Baseline seed: 1337.","baselineOutcomeMetrics":{"accuracy":0.0,"brierScore":0.0,"drawAccuracy":null,"ece":0.0,"lossAccuracy":null,"nll":0.0,"samplesEvaluated":0,"winAccuracy":null},"baselinePolicyMetrics":{"entropy":3.258749,"nll":19.69687,"samplesEvaluated":10000,"top1Accuracy":0.0051,"top3Accuracy":0.0254,"top5Accuracy":0.0416},"bySkillBucket":[{"baselineOutcomeMetrics":{"accuracy":0.0,"brierScore":0.0,"drawAccuracy":null,"ece":0.0,"lossAccuracy":null,"nll":0.0,"samplesEvaluated":0,"winAccuracy":null},"baselinePolicyMetrics":{"entropy":3.249301,"nll":19.714879,"samplesEvaluated":1429,"top1Accuracy":0.0,"top3Accuracy":0.0,"top5Accuracy":0.010497},"samples":1429,"skillBucket":"lt_800","trainedOutcomeMetrics":{"accuracy":0.0,"brierScore":0.0,"drawAccuracy":null,"ece":0.0,"lossAccuracy":null,"nll":0.0,"samplesEvaluated":0,"winAccuracy":null},"trainedPolicyMetrics":{"entropy":3.25739,"nll":19.72764,"samplesEvaluated":1429,"top1Accuracy":0.0,"top3Accuracy":0.002799,"top5Accuracy":0.011896}},{"baselineOutcomeMetrics":{"accuracy":0.0,"brierScore":0.0,"drawAccuracy":null,"ece":0.0,"lossAccuracy":null,"nll":0.0,"samplesEvaluated":0,"winAccuracy":null},"baselinePolicyMetrics":{"entropy":3.263641,"nll":19.671122,"samplesEvaluated":1429,"top1Accuracy":0.013996,"top3Accuracy":0.062981,"top5Accuracy":0.097271},"samples":1429,"skillBucket":"800_999","trainedOutcomeMetrics":{"accuracy":0.0,"brierScore":0.0,"drawAccuracy":null,"ece":0.0,"lossAccuracy":null,"nll":0.0,"samplesEvaluated":0,"winAccuracy":null},"trainedPolicyMetrics":{"entropy":3.259071,"nll":19.707109,"samplesEvaluated":1429,"top1Accuracy":0.0,"top3Accuracy":0.005598,"top5Accuracy":0.014696}},{"baselineOutcomeMetrics":{"accuracy":0.0,"brierScore":0.0,"drawAccuracy":null,"ece":0.0,"lossAccuracy":null,"nll":0.0,"samplesEvaluated":0,"winAccuracy":null},"baselinePolicyMetrics":{"entropy":3.25651,"nll":19.666277,"samplesEvaluated":1429,"top1Accuracy":0.007698,"top3Accuracy":0.029391,"top5Accuracy":0.063681},"samples":1429,"skillBucket":"1000_1199","trainedOutcomeMetrics":{"accuracy":0.0,"brierScore":0.0,"drawAccuracy":null,"ece":0.0,"lossAccuracy":null,"nll":0.0,"samplesEvaluated":0,"winAccuracy":null},"trainedPolicyMetrics":{"entropy":3.258925,"nll":19.681044,"samplesEvaluated":1429,"top1Accuracy":0.0,"top3Accuracy":0.014696,"top5Accuracy":0.03219}},{"baselineOutcomeMetrics":{"accuracy":0.0,"brierScore":0.0,"drawAccuracy":null,"ece":0.0,"lossAccuracy":null,"nll":0.0,"samplesEvaluated":0,"winAccuracy":null},"baselinePolicyMetrics":{"entropy":3.250644,"nll":19.721636,"samplesEvaluated":1429,"top1Accuracy":0.0,"top3Accuracy":0.0,"top5Accuracy":0.006298},"samples":1429,"skillBucket":"1200_1399","trainedOutcomeMetrics":{"accuracy":0.0,"brierScore":0.0,"drawAccuracy":null,"ece":0.0,"lossAccuracy":null,"nll":0.0,"samplesEvaluated":0,"winAccuracy":null},"trainedPolicyMetrics":{"entropy":3.265925,"nll":19.716839,"samplesEvaluated":1429,"top1Accuracy":0.002799,"top3Accuracy":0.016095,"top5Accuracy":0.023793}},{"baselineOutcomeMetrics":{"accuracy":0.0,"brierScore":0.0,"drawAccuracy":null,"ece":0.0,"lossAccuracy":null,"nll":0.0,"samplesEvaluated":0,"winAccuracy":null},"baselinePolicyMetrics":{"entropy":3.267705,"nll":19.680766,"samplesEvaluated":1428,"top1Accuracy":0.004902,"top3Accuracy":0.05112,"top5Accuracy":0.067927},"samples":1428,"skillBucket":"1400_1599","trainedOutcomeMetrics":{"accuracy":0.0,"brierScore":0.0,"drawAccuracy":null,"ece":0.0,"lossAccuracy":null,"nll":0.0,"samplesEvaluated":0,"winAccuracy":null},"trainedPolicyMetrics":{"entropy":3.258475,"nll":19.707955,"samplesEvaluated":1428,"top1Accuracy":0.0,"top3Accuracy":0.005602,"top5Accuracy":0.013305}},{"baselineOutcomeMetrics":{"accuracy":0.0,"brierScore":0.0,"drawAccuracy":null,"ece":0.0,"lossAccuracy":null,"nll":0.0,"samplesEvaluated":0,"winAccuracy":null},"baselinePolicyMetrics":{"entropy":3.255166,"nll":19.733768,"samplesEvaluated":1428,"top1Accuracy":0.0,"top3Accuracy":0.0,"top5Accuracy":0.0},"samples":1428,"skillBucket":"1600_1799","trainedOutcomeMetrics":{"accuracy":0.0,"brierScore":0.0,"drawAccuracy":null,"ece":0.0,"lossAccuracy":null,"nll":0.0,"samplesEvaluated":0,"winAccuracy":null},"trainedPolicyMetrics":{"entropy":3.254242,"nll":19.706963,"samplesEvaluated":1428,"top1Accuracy":0.0,"top3Accuracy":0.008403,"top5Accuracy":0.022409}},{"baselineOutcomeMetrics":{"accuracy":0.0,"brierScore":0.0,"drawAccuracy":null,"ece":0.0,"lossAccuracy":null,"nll":0.0,"samplesEvaluated":0,"winAccuracy":null},"baselinePolicyMetrics":{"entropy":3.268285,"nll":19.689652,"samplesEvaluated":1428,"top1Accuracy":0.009104,"top3Accuracy":0.034314,"top5Accuracy":0.045518},"samples":1428,"skillBucket":"gte_1800","trainedOutcomeMetrics":{"accuracy":0.0,"brierScore":0.0,"drawAccuracy":null,"ece":0.0,"lossAccuracy":null,"nll":0.0,"samplesEvaluated":0,"winAccuracy":null},"trainedPolicyMetrics":{"entropy":3.244894,"nll":19.70038,"samplesEvaluated":1428,"top1Accuracy":0.0,"top3Accuracy":0.003501,"top5Accuracy":0.011905}}],"codeCommitSha":"698d242d813c718950cf1341dce6c8b58969de79","determinismHash":"sha256:3897a8b093be71536f253a59572c2506c837056e7437e26c264631a135135c42","evalBaselineSeed":1337,"frozenEvalIntegrity":{"iterationDeterministic":true,"manifestHash":"sha256:73a0c4aa599b156303c5978a310326038be6494a2f5130c4d33e26d2eeefe595","noTrainingOverlap":true,"positionCount":10000,"shardCount":10,"skillBucketCounts":{"1000_1199":1429,"1200_1399":1429,"1400_1599":1428,"1600_1799":1428,"800_999":1429,"gte_1800":1428,"lt_800":1429}},"frozenEvalManifestHash":"sha256:73a0c4aa599b156303c5978a310326038be6494a2f5130c4d33e26d2eeefe595","generatedAt":"2026-02-03T04:54:54.782745Z","outcomeCheckpointHash":"sha256:d815f508faea47efe8ea200e2281b74b77dffaea2d9c56e4cda8da84232f0b55","outcomeDelta":{"direction":"unchanged","isSignificant":false,"percentageChange":null,"primaryMetric":"accuracy","primaryMetricBaseline":0.0,"primaryMetricDelta":0.0,"primaryMetricTrained":0.0},"policyCheckpointHash":"sha256:94b652688b2c31a90963c33165684205928b47001781cd23436b0fe990289395","policyDelta":{"direction":"degraded","isSignificant":false,"percentageChange":-92.16,"primaryMetric":"top1_accuracy","primaryMetricBaseline":0.0051,"primaryMetricDelta":-0.0047,"primaryMetricTrained":0.0004},"positionsEvaluated":10000,"trainedOutcomeMetrics":{"accuracy":0.0,"brierScore":0.0,"drawAccuracy":null,"ece":0.0,"lossAccuracy":null,"nll":0.0,"samplesEvaluated":0,"winAccuracy":null},"trainedPolicyMetrics":{"entropy":3.25699,"nll":19.706848,"samplesEvaluated":10000,"top1Accuracy":0.0004,"top3Accuracy":0.0081,"top5Accuracy":0.0186},"trainingRunReportHash":"sha256:6462f2f223d1157b8623137964d82a4340a4387d1da690b4e7a6587fc4590b0a","version":"1.0"}